<?xml version="1.0" encoding="UTF-8"?>
<Document xmlns="std:rims:2015:tech:xsd:sjcj.001.001.01"
xmlns:xsi="http://www.w3.org/2001/XMLSchema-instance"
xsi:schemaLocation="std:rims:2015:tech:xsd:sjcj.001.001.01 file:/C:/Users/keji/Desktop/sjcj.001.001.02.xsd">
<AgreEffMessg>
<AgreIDSec>
<AgreID>AgreID0</AgreID>
<OrgID>A00000000000000000</OrgID>
</AgreIDSec>
<AgreSumSec>
<AgreNum>AgreNum0</AgreNum>
<InfAgen>
<BorrAgen>
<Nam>Nam0</Nam>
<IDType>1</IDType>
<IDNum>IDNum0</IDNum>
</BorrAgen>
<CreAgen>
<Nam>Nam1</Nam>
<IDType>1</IDType>
<IDNum>IDNum1</IDNum>
</CreAgen>
</InfAgen>
<InfAgen>
<BorrAgen>
<Nam>Nam2</Nam>
<IDType>1</IDType>
<IDNum>IDNum2</IDNum>
</BorrAgen>
<CreAgen>
<Nam>Nam3</Nam>
<IDType>1</IDType>
<IDNum>IDNum3</IDNum>
</CreAgen>
</InfAgen>
<ReDate>2006-05-04</ReDate>
<EfDate>2006-05-04</EfDate>
<DeDate>2006-05-04</DeDate>
<GuaWa>1</GuaWa>
<BusiType>1</BusiType>
<CreLinCur>AAA</CreLinCur>
<CreLinAm>0</CreLinAm>
<CreLinAdjDate>2006-05-04</CreLinAdjDate>
<CreLinCir>1</CreLinCir>
</AgreSumSec>
<GuarSec>
<GuaAgreNum>GuaAgreNum0</GuaAgreNum>
<GuaSta>1</GuaSta>
<GuaWa>1</GuaWa>
</GuarSec>
<IntRatSec>
<IntRatRef>1</IntRatRef>
<IntRatChRat>IntRa</IntRatChRat>
<IntRatChWa>1</IntRatChWa>
<IntRatChFre>1</IntRatChFre>
</IntRatSec>
<AgreStaSec>
<AgreSta>1</AgreSta>
<AgreStaChDate>2006-05-04</AgreStaChDate>
</AgreStaSec>
</AgreEffMessg>
</Document>
